{"$schema":"https://json-schema.org/draft/2020-12/schema","$id":"drowned_harbor_external_visual_rights_and_provenance_register_schema_v1","title":"Drowned Harbor External Visual Rights and Provenance Register v1","type":"object","additionalProperties":false,"required":["schema_version","record_kind","release_id","record_id","protected_main_starting_sha","package","disposition","inventory_summary","terms_snapshot","accepted_lifecycle","remaining_prerequisites","assets","external_binary_policy","governance"],"properties":{"schema_version":{"const":1},"record_kind":{"const":"drowned_harbor_external_visual_rights_and_provenance_registration"},"release_id":{"const":"DH-RIGHTS-REG-001"},"record_id":{"const":"DH-RIGHTS-001"},"protected_main_starting_sha":{"const":"3aa7d3b8dd32ef50738098780c15a27890961e50"},"package":{"type":"object","additionalProperties":false,"required":["uploaded_archive_name","internal_package_name","bytes","sha256","zip_crc","manifest_bytes","manifest_sha256","manifested_payload_count_excluding_manifest","missing_payloads","extra_payloads","payload_hash_or_byte_mismatches"],"properties":{"uploaded_archive_name":{"const":"DH-RIGHTS-001_External_Visual_Rights_and_Provenance_Resolution_Package_v1(1).zip"},"internal_package_name":{"const":"DH-RIGHTS-001_External_Visual_Rights_and_Provenance_Resolution_Package_v1"},"bytes":{"const":61194347},"sha256":{"const":"ce79e9413fd93405f01691eeefbe7e17dfdc103d40be076a73a3b218f7b26dcb"},"zip_crc":{"const":"clean"},"manifest_bytes":{"const":9038},"manifest_sha256":{"const":"386e325e46a5f8b0ba3ba15893af5fe33c70f95f397f05c939b2058f2573968d"},"manifested_payload_count_excluding_manifest":{"const":37},"missing_payloads":{"const":[]},"extra_payloads":{"const":[]},"payload_hash_or_byte_mismatches":{"const":[]}}},"disposition":{"type":"object","additionalProperties":false,"required":["review_result","status","conversion_readiness","implementation_authorized","rights_and_provenance_prerequisite_complete","remaining_blocker","direct_generated_pixel_use_authorized","source_art_authorized","runtime_art_authorized","godot_authorized","codex_authorized","candidate_creation_or_promotion_authorized","public_repository_or_release_assets_authorized","marketing_storefront_or_merchandise_authorized","human_evidence_claimed","accessibility_or_readability_claimed","production_or_shipping_authorized"],"properties":{"review_result":{"const":"accepted_with_required_corrections"},"status":{"const":"partial_resolution_for_private_internal_reference_only"},"conversion_readiness":{"const":"not_ready"},"implementation_authorized":{"const":false},"rights_and_provenance_prerequisite_complete":{"const":false},"remaining_blocker":{"const":"project_owner_attestation_and_generation_session_reconstruction"},"direct_generated_pixel_use_authorized":{"const":false},"source_art_authorized":{"const":false},"runtime_art_authorized":{"const":false},"godot_authorized":{"const":false},"codex_authorized":{"const":false},"candidate_creation_or_promotion_authorized":{"const":false},"public_repository_or_release_assets_authorized":{"const":false},"marketing_storefront_or_merchandise_authorized":{"const":false},"human_evidence_claimed":{"const":false},"accessibility_or_readability_claimed":{"const":false},"production_or_shipping_authorized":{"const":false}}},"inventory_summary":{"type":"object","additionalProperties":false,"required":["unique_image_binary_count","true_png_count","jpeg_binary_with_png_filename_count","jpeg_binary_with_png_filename_asset_keys","provider_counts","locally_detected_openai_c2pa_reference_count_not_authenticated","locally_detected_openai_c2pa_reference_asset_keys","openai_source_attribution_only_asset_keys","gemini_source_attribution_asset_keys","unknown_provider_count","duplicate_sha256_group_count"],"properties":{"unique_image_binary_count":{"const":25},"true_png_count":{"const":21},"jpeg_binary_with_png_filename_count":{"const":4},"jpeg_binary_with_png_filename_asset_keys":{"const":["EXT-VIS-020","EXT-VIS-021","EXT-VIS-022","EXT-VIS-025"]},"provider_counts":{"const":{"openai":21,"google_gemini":4}},"locally_detected_openai_c2pa_reference_count_not_authenticated":{"const":16},"locally_detected_openai_c2pa_reference_asset_keys":{"const":["EXT-VIS-004","EXT-VIS-006","EXT-VIS-007","EXT-VIS-008","EXT-VIS-009","EXT-VIS-010","EXT-VIS-011","EXT-VIS-012","EXT-VIS-013","EXT-VIS-014","EXT-VIS-015","EXT-VIS-016","EXT-VIS-017","EXT-VIS-019","EXT-VIS-023","EXT-VIS-024"]},"openai_source_attribution_only_asset_keys":{"const":["EXT-VIS-001","EXT-VIS-002","EXT-VIS-003","EXT-VIS-005","EXT-VIS-020"]},"gemini_source_attribution_asset_keys":{"const":["EXT-VIS-018","EXT-VIS-021","EXT-VIS-022","EXT-VIS-025"]},"unknown_provider_count":{"const":0},"duplicate_sha256_group_count":{"const":0}}},"terms_snapshot":{"type":"object","additionalProperties":false,"required":["classification","openai_current_terms_checked","google_current_terms_checked","does_not_establish"],"properties":{"classification":{"const":"planning_evidence_not_legal_advice"},"openai_current_terms_checked":{"const":"2026-08-05"},"google_current_terms_checked":{"const":"2026-08-05"},"does_not_establish":{"const":["copyrightability","input_rights","non_infringement","exclusivity","generation_time_account_or_product_terms","project_lifecycle_approval"]}}},"accepted_lifecycle":{"type":"object","additionalProperties":false,"required":["all_assets","abstract_concepts","R3_human_authored_source_reconstruction","R4_production_candidate","R5_approved_production_or_public_asset"],"properties":{"all_assets":{"const":"R1_private_internal_reference"},"abstract_concepts":{"const":"R2_planning_without_pixel_reuse_permitted"},"R3_human_authored_source_reconstruction":{"const":"not_authorized_by_this_release"},"R4_production_candidate":{"const":"not_authorized"},"R5_approved_production_or_public_asset":{"const":"not_authorized"}}},"remaining_prerequisites":{"const":["project_owner_rights_and_provenance_attestation","generation_session_reconstruction_by_image_family","uploaded_reference_inventory_and_rights_basis","known_human_edit_and_export_chain","provider_product_and_account_type_confirmation","optional_openai_or_google_provider_verification_for_unverified_assets","separate_release_coordination_activation_before_clean_room_source_art_planning"]},"assets":{"type":"array","minItems":25,"maxItems":25,"items":{"type":"object","additionalProperties":false,"required":["id","filename","sha256","bytes","dimensions","format","provider","classification"],"properties":{"id":{"type":"string","pattern":"^EXT-VIS-[0-9]{3}$"},"filename":{"type":"string"},"sha256":{"type":"string","pattern":"^[0-9a-f]{64}$"},"bytes":{"type":"integer","minimum":1},"dimensions":{"type":"array","minItems":2,"maxItems":2,"items":{"type":"integer","minimum":1}},"format":{"enum":["PNG","JPEG"]},"provider":{"enum":["openai","google_gemini"]},"classification":{"enum":["openai_c2pa_reference_detected_not_authenticated","openai_source_attribution_only","gemini_source_attribution_only"]}}}},"external_binary_policy":{"type":"object","additionalProperties":false,"required":["images_in_git","archive_in_git","public_github_release_assets","binary_storage_location"],"properties":{"images_in_git":{"const":false},"archive_in_git":{"const":false},"public_github_release_assets":{"const":false},"binary_storage_location":{"const":"external_private_only"}}},"governance":{"type":"object","additionalProperties":false,"required":["naming_gate_issue","human_evidence_gate_issue","unrelated_pull_request_excluded","lantern_house_remains_sole_normal_default_tale","drowned_harbor_remains_developer_only_and_ordinary_export_excluded"],"properties":{"naming_gate_issue":{"const":7},"human_evidence_gate_issue":{"const":39},"unrelated_pull_request_excluded":{"const":32},"lantern_house_remains_sole_normal_default_tale":{"const":true},"drowned_harbor_remains_developer_only_and_ordinary_export_excluded":{"const":true}}}}}