{"schema_version":1,"record_kind":"drowned_harbor_external_visual_rights_and_provenance_registration","release_id":"DH-RIGHTS-REG-001","record_id":"DH-RIGHTS-001","protected_main_starting_sha":"3aa7d3b8dd32ef50738098780c15a27890961e50","package":{"uploaded_archive_name":"DH-RIGHTS-001_External_Visual_Rights_and_Provenance_Resolution_Package_v1(1).zip","internal_package_name":"DH-RIGHTS-001_External_Visual_Rights_and_Provenance_Resolution_Package_v1","bytes":61194347,"sha256":"ce79e9413fd93405f01691eeefbe7e17dfdc103d40be076a73a3b218f7b26dcb","zip_crc":"clean","manifest_bytes":9038,"manifest_sha256":"386e325e46a5f8b0ba3ba15893af5fe33c70f95f397f05c939b2058f2573968d","manifested_payload_count_excluding_manifest":37,"missing_payloads":[],"extra_payloads":[],"payload_hash_or_byte_mismatches":[]},"disposition":{"review_result":"accepted_with_required_corrections","status":"partial_resolution_for_private_internal_reference_only","conversion_readiness":"not_ready","implementation_authorized":false,"rights_and_provenance_prerequisite_complete":false,"remaining_blocker":"project_owner_attestation_and_generation_session_reconstruction","direct_generated_pixel_use_authorized":false,"source_art_authorized":false,"runtime_art_authorized":false,"godot_authorized":false,"codex_authorized":false,"candidate_creation_or_promotion_authorized":false,"public_repository_or_release_assets_authorized":false,"marketing_storefront_or_merchandise_authorized":false,"human_evidence_claimed":false,"accessibility_or_readability_claimed":false,"production_or_shipping_authorized":false},"inventory_summary":{"unique_image_binary_count":25,"true_png_count":21,"jpeg_binary_with_png_filename_count":4,"jpeg_binary_with_png_filename_asset_keys":["EXT-VIS-020","EXT-VIS-021","EXT-VIS-022","EXT-VIS-025"],"provider_counts":{"openai":21,"google_gemini":4},"locally_detected_openai_c2pa_reference_count_not_authenticated":16,"locally_detected_openai_c2pa_reference_asset_keys":["EXT-VIS-004","EXT-VIS-006","EXT-VIS-007","EXT-VIS-008","EXT-VIS-009","EXT-VIS-010","EXT-VIS-011","EXT-VIS-012","EXT-VIS-013","EXT-VIS-014","EXT-VIS-015","EXT-VIS-016","EXT-VIS-017","EXT-VIS-019","EXT-VIS-023","EXT-VIS-024"],"openai_source_attribution_only_asset_keys":["EXT-VIS-001","EXT-VIS-002","EXT-VIS-003","EXT-VIS-005","EXT-VIS-020"],"gemini_source_attribution_asset_keys":["EXT-VIS-018","EXT-VIS-021","EXT-VIS-022","EXT-VIS-025"],"unknown_provider_count":0,"duplicate_sha256_group_count":0},"terms_snapshot":{"classification":"planning_evidence_not_legal_advice","openai_current_terms_checked":"2026-08-05","google_current_terms_checked":"2026-08-05","does_not_establish":["copyrightability","input_rights","non_infringement","exclusivity","generation_time_account_or_product_terms","project_lifecycle_approval"]},"accepted_lifecycle":{"all_assets":"R1_private_internal_reference","abstract_concepts":"R2_planning_without_pixel_reuse_permitted","R3_human_authored_source_reconstruction":"not_authorized_by_this_release","R4_production_candidate":"not_authorized","R5_approved_production_or_public_asset":"not_authorized"},"remaining_prerequisites":["project_owner_rights_and_provenance_attestation","generation_session_reconstruction_by_image_family","uploaded_reference_inventory_and_rights_basis","known_human_edit_and_export_chain","provider_product_and_account_type_confirmation","optional_openai_or_google_provider_verification_for_unverified_assets","separate_release_coordination_activation_before_clean_room_source_art_planning"],"assets":[{"id":"EXT-VIS-001","filename":"DH-BMOD-001_Lighthouse_Landmark_and_Lantern_Mechanism_Concept_Study_v1.png","sha256":"25a6fb006f223461d09144037818678aa6558c35ec7eb576ea4d7d24ed9ec6ef","bytes":3707886,"dimensions":[1672,941],"format":"PNG","provider":"openai","classification":"openai_source_attribution_only"},{"id":"EXT-VIS-002","filename":"DH-BMOD-002_Bellhouse_Landmark_and_Mechanism_Concept_Study_v1.png","sha256":"7e9bcce999ffc68a34b13f56489cd875fd626f14d60be5ffe06e694cc7d340c1","bytes":3697661,"dimensions":[1672,941],"format":"PNG","provider":"openai","classification":"openai_source_attribution_only"},{"id":"EXT-VIS-003","filename":"DH-BMOD-003_Drowned_Archive_Landmark_and_Access_Mechanism_Concept_Study_v1.png","sha256":"04416d770cc5197afd19ea4c72fcc901324ffa7948aa525c936405d5d2ef94a8","bytes":3776052,"dimensions":[1672,941],"format":"PNG","provider":"openai","classification":"openai_source_attribution_only"},{"id":"EXT-VIS-004","filename":"DH-BMOD-004_Salt_Market_Landmark_and_Modular_Gameplay-Space_Concept_Study_v1.png","sha256":"31c8dd42a5f0f0746540a54c7cf5188d115225b4c84bd3406f810253c5fae737","bytes":2872532,"dimensions":[1672,941],"format":"PNG","provider":"openai","classification":"openai_c2pa_reference_detected_not_authenticated"},{"id":"EXT-VIS-005","filename":"DH-BMOD-005_Lifeboat_Shed_and_Launch_Mechanism_Concept_Study_v1.png","sha256":"f37cea3322b2730d68c09107c78f433daf6a37465b72f2794a8db018df444569","bytes":3791655,"dimensions":[1672,941],"format":"PNG","provider":"openai","classification":"openai_source_attribution_only"},{"id":"EXT-VIS-006","filename":"DH-BMOD-006_Causeway_Mudflat_Approach_Concept_Study_v1.png","sha256":"f71f4b308183fda120998d3e3f54d40745ca2eb4e62aef354a61eebbf6e7216a","bytes":2917355,"dimensions":[1672,941],"format":"PNG","provider":"openai","classification":"openai_c2pa_reference_detected_not_authenticated"},{"id":"EXT-VIS-007","filename":"DH-BMOD-007_Supporting_Harbor_Structures_Family_Study_v1.png","sha256":"04b47454734fce5ab9a58ef6b8cada9b0a956b1dd57af61eb2402a1e0f3868d5","bytes":2806414,"dimensions":[1672,941],"format":"PNG","provider":"openai","classification":"openai_c2pa_reference_detected_not_authenticated"},{"id":"EXT-VIS-008","filename":"DH-BMOD-FAMILY-001_Drowned_Harbor_Landmark_Family_Consistency_Study_v1.png","sha256":"510962c1939bc425a38ed0b54133c9b56e521831741638de4aadebb2a01179e9","bytes":2822071,"dimensions":[1536,1024],"format":"PNG","provider":"openai","classification":"openai_c2pa_reference_detected_not_authenticated"},{"id":"EXT-VIS-009","filename":"DH-CHAR-FAMILY-001_Drowned_Harbor_Resident_and_Role_Silhouette_Family_Study_v1.png","sha256":"1ac0dfa90b54eaebe60e1cc9326dd9232141f87c740cdab8dbda7498c62ff87b","bytes":2972913,"dimensions":[1536,1024],"format":"PNG","provider":"openai","classification":"openai_c2pa_reference_detected_not_authenticated"},{"id":"EXT-VIS-010","filename":"DH-MAT-001_Drowned_Harbor_Materials_and_Surface_Library_v1.png","sha256":"912792d5f9f6705fb3418e590ea5eca2bfe709368f3a3c8a205e5a0bcf68fab8","bytes":2793660,"dimensions":[1672,941],"format":"PNG","provider":"openai","classification":"openai_c2pa_reference_detected_not_authenticated"},{"id":"EXT-VIS-011","filename":"DH-PRESENT-001_Drowned_Harbor_High_Water_Environmental_Presentation-Hook_Storyboard_Study_v1.png","sha256":"51e2a1774529500385260d1800aacd1f3265024db6cc0b93c0e76ee8a363cc07","bytes":2497096,"dimensions":[1536,1024],"format":"PNG","provider":"openai","classification":"openai_c2pa_reference_detected_not_authenticated"},{"id":"EXT-VIS-012","filename":"DH-PRESENT-002_Drowned_Harbor_Last_Light_Environmental_Presentation-Hook_Storyboard_Study_v1.png","sha256":"904aa44dfa2b6980d88d0776213d28d3e1fa3b2b8acba7798fdbed84e526e00e","bytes":2809928,"dimensions":[1672,941],"format":"PNG","provider":"openai","classification":"openai_c2pa_reference_detected_not_authenticated"},{"id":"EXT-VIS-013","filename":"DH-PRESENT-003_Drowned_Harbor_Ending_Resolution_and_Epilogue_Attribution_Presentation-Hook_Storyboard_Study_v1.png","sha256":"dc8cd6ee426c486043a688bcf3a89025597e2c96b2b66e4064392b9bd9f901b2","bytes":2580384,"dimensions":[1536,1024],"format":"PNG","provider":"openai","classification":"openai_c2pa_reference_detected_not_authenticated"},{"id":"EXT-VIS-014","filename":"DH-PROFILE-001_Drowned_Harbor_Spooky_versus_Grim_Presentation_Profile_Invariant_Study_v1.png","sha256":"c54e0cdb412daab719819c803c1ea4d6817cbcf9f506b35aea82fd9646d9687a","bytes":2811491,"dimensions":[1536,1024],"format":"PNG","provider":"openai","classification":"openai_c2pa_reference_detected_not_authenticated"},{"id":"EXT-VIS-015","filename":"DH-CHAR-StableSeat-Transformation_Studio-v1.png","sha256":"12cf4422ba189c038844d139d828f1f92fe8fd8209649c1d8197ecdbae052a60","bytes":2275183,"dimensions":[1672,941],"format":"PNG","provider":"openai","classification":"openai_c2pa_reference_detected_not_authenticated"},{"id":"EXT-VIS-016","filename":"DH-ENV-001_Studio_v3.png","sha256":"9f343570adb0e51f6d7215bd73434f25fb2af1e502641f15c0ef4de50ccfc587","bytes":2961556,"dimensions":[1672,941],"format":"PNG","provider":"openai","classification":"openai_c2pa_reference_detected_not_authenticated"},{"id":"EXT-VIS-017","filename":"DH-ENV-002_Studio_v2.png","sha256":"30aeb03f169506a3889635219b4e3afbe03720d8c3e1405d1d1424c1e5425a88","bytes":2864008,"dimensions":[1672,941],"format":"PNG","provider":"openai","classification":"openai_c2pa_reference_detected_not_authenticated"},{"id":"EXT-VIS-018","filename":"TerrorTurn_Mechanism-and-Icon-Grammar_Gemini-v1.png","sha256":"30a54b35c4b6176159bab260cc8b17af98985d879d3d33863c8d8ef287512975","bytes":820381,"dimensions":[987,547],"format":"PNG","provider":"google_gemini","classification":"gemini_source_attribution_only"},{"id":"EXT-VIS-019","filename":"TerrorTurn_Shared-UI-State-Grammar_Studio-v1.png","sha256":"67176e1c4e093e21e4febab1a8cb8871936605662fbd7428e506243e58d33bdb","bytes":2795625,"dimensions":[1536,1024],"format":"PNG","provider":"openai","classification":"openai_c2pa_reference_detected_not_authenticated"},{"id":"EXT-VIS-020","filename":"DH-ENV-001_External-ChatGPT_v2.png","sha256":"78ba2f5b050635b65df2e2b26fe7237238fdc19da4ded2fafdcda384f6d76818","bytes":430465,"dimensions":[1536,864],"format":"JPEG","provider":"openai","classification":"openai_source_attribution_only"},{"id":"EXT-VIS-021","filename":"DH-ENV-001_Gemini_Layout-Synthesis_v3.png","sha256":"0fbc0caf6ca2c2439d855cd81276f5e2b8ed918a0b37234f106be3f792913738","bytes":333885,"dimen